Sheet: Sheet1
A1: item | B1: quantity | C1: unit price | D1: total
A2: apples | B2: 2 | C2: 0.33 | D2: of:=[.B2]*[.C2] -> 0.66
A3: bananas | B3: 5 | C3: 0.1 | D3: of:=[.B3]*[.C3] -> 0.5
A4: milk | B4: 1 | C4: 2.5 | D4: of:=[.B4]*[.C4] -> 2.5
A5: soda | B5: 3 | C5: 1 | D5: of:=[.B5]*[.C5] -> 3
A6: rolls | B6: 12 | C6: 0.33 | D6: of:=[.B6]*[.C6] -> 3.96
A7: eggs | B7: 1 | C7: 2.5 | D7: of:=[.B7]*[.C7] -> 2.5